<?xml version="1.0" encoding="iso-8859-1" ?>
<?xml-stylesheet href="Q10-SML.css" type="text/css"?>

<!DOCTYPE petit-texte SYSTEM "Q7-DTD.dtd">
<body>
    <personne>
        <id num='1'/>
    	<nom>Nelson Van Amerungen</nom>
    	<site-web>
            <lien>
            https://Un-personne-ultra-sympa.fabinie/Monkey
            </lien>
        </site-web>
        <reputation num='5417'/>
        <capital num='2'/>
    
    </personne>

    <documentation>
        Le gitHub du projet :
        <lien>https://github.com/Wabtey/art-manipulation</lien>
    </documentation>
</body>
